{
    "schema_version": "1.0.0",
    "id": "language.r84",
    "title": "Fixture: language.r84",
    "summary": "Synthetic fixture rule for ApplicabilityEvaluatorTest; not a real guideline.",
    "category": "language",
    "kind": "removed",
    "priority": "P2",
    "introduced_in": null,
    "deprecated_in": "8.3",
    "removed_in": "8.4",
    "extension": null,
    "package_constraints": {},
    "behavior_change_risk": "none",
    "new_code_policy": "Fixture only; not real guidance.",
    "existing_code_policy": "Fixture only; not real guidance.",
    "guideline": "Fixture only; not real guidance.",
    "details": "Synthetic rule used solely by ApplicabilityEvaluatorTest.",
    "examples": [
        {
            "no_automatic_replacement": true
        }
    ],
    "verification": {
        "phpcompatibility": null,
        "phpstan": null,
        "rector": null
    },
    "sources": [
        {
            "type": "php_source_upgrading",
            "url": "https://raw.githubusercontent.com/php/php-src/php-8.2.0/UPGRADING",
            "checked_at": "2026-08-30"
        }
    ],
    "notes": []
}
